{
  "id": "exch_1",
  "specVersion": "0.2",
  "tenantId": "tenant_demo",
  "orderId": "ord_small",
  "originalLineId": "line_1",
  "replacementSku": "sku_mug_v2",
  "replacementVariant": "blue",
  "inventoryStatus": "in_stock",
  "priceDelta": { "currency": "USD", "minorUnits": -500 },
  "returnRequired": true,
  "status": "pending_approval",
  "evidenceIds": ["ev_ord_small"],
  "createdAt": "2026-09-06T12:00:00.000Z",
  "updatedAt": "2026-09-06T12:00:00.000Z"
}
